{
  "evidenceId": "evidence_s002_0001",
  "title": "Single unconfirmed evidence",
  "description": "Only one weak source is available. Independent corroboration is missing.",
  "evidenceType": "external_reference",
  "source": {
    "sourceType": "url",
    "sourceRef": "https://example.com/unconfirmed-claim",
    "sourceName": "Unconfirmed external reference",
    "sourceVersion": "unknown",
    "retrievedAt": "2026-07-09T16:00:00Z"
  },
  "verificationStatus": "unverified",
  "reliability": "low",
  "independenceScore": 0.2,
  "confidence": 0.28,
  "knowledgeRefs": [],
  "kcpSessionRefs": [
    "kcp_s002_0001"
  ],
  "submittedByAgentId": "agent_reviewer_001",
  "contentRef": "external_reference_s002_0001",
  "auditRefs": [
    "audit_s002_0001"
  ],
  "eventRefs": [
    "event_s002_0001"
  ],
  "metadata": {
    "scenario": "scenario-002-insufficient-evidence",
    "schemaVersion": "1.0.0",
    "expectedResult": "unverified",
    "knowledgePublished": false
  },
  "extensions": {},
  "collectedAt": "2026-07-09T16:00:00Z",
  "createdAt": "2026-07-09T16:00:00Z",
  "updatedAt": "2026-07-09T16:00:00Z"
}
